Description,Energy,Protein,Total lipid (fat),"Carbohydrate, by difference","Potassium, K","Calcium, Ca","Magnesium, Mg"
"Vinespinach, (basella), raw",19.0,1.8,0.3,3.4,510.0,109.0,65.0
"Wasabi, root, raw",109.0,4.8,0.63,23.5,568.0,128.0,69.0
"Water convolvulus, cooked, boiled, drained, with salt",20.0,2.08,0.24,3.7,284.0,54.0,30.0
"Water convolvulus, cooked, boiled, drained, without salt",20.0,2.08,0.24,3.7,284.0,54.0,30.0
"Water convolvulus,raw",19.0,2.6,0.2,3.13,312.0,77.0,71.0
"Waterchestnuts, chinese, (matai), raw",97.0,1.4,0.1,23.9,584.0,11.0,22.0
"Waterchestnuts, chinese, canned, solids and liquids",50.0,0.88,0.06,12.3,118.0,4.0,5.0
"Watercress, raw",11.0,2.3,0.1,1.29,330.0,120.0,21.0
"Waxgourd, (chinese preserving melon), cooked, boiled, drained, with salt",11.0,0.4,0.2,2.45,5.0,18.0,10.0
"Waxgourd, (chinese preserving melon), cooked, boiled, drained, without salt",14.0,0.4,0.2,3.04,5.0,18.0,10.0
"Waxgourd, (chinese preserving melon), raw",13.0,0.4,0.2,3.0,6.0,19.0,10.0
"Winged bean leaves, raw",74.0,5.85,1.1,14.1,176.0,224.0,8.0
"Winged bean tuber, raw",148.0,11.6,0.9,28.1,586.0,30.0,24.0
"Winged bean, immature seeds, cooked, boiled, drained, with salt",37.0,5.31,0.66,3.21,274.0,61.0,30.0
"Winged beans, immature seeds, cooked, boiled, drained, without salt",38.0,5.31,0.66,3.21,274.0,61.0,30.0
"Winged beans, immature seeds, raw",49.0,6.95,0.87,4.31,223.0,84.0,34.0
"Yam, cooked, boiled, drained, or baked, with salt",114.0,1.49,0.14,27.0,670.0,14.0,18.0
"Yam, cooked, boiled, drained, or baked, without salt",116.0,1.49,0.14,27.5,670.0,14.0,18.0
"Yam, raw",118.0,1.53,0.17,27.9,816.0,17.0,21.0
"Yambean (jicama), cooked, boiled, drained, with salt",36.0,0.72,0.09,8.23,135.0,11.0,11.0
"Yambean (jicama), cooked, boiled, drained, without salt",38.0,0.72,0.09,8.82,135.0,11.0,11.0
"Yambean (jicama), raw",38.0,0.72,0.09,8.82,150.0,12.0,12.0
"Yardlong bean, cooked, boiled, drained, with salt",47.0,2.53,0.1,9.17,290.0,44.0,42.0
"Yardlong bean, cooked, boiled, drained, without salt",47.0,2.53,0.1,9.18,290.0,44.0,42.0
"Yardlong bean, raw",47.0,2.8,0.4,8.35,240.0,50.0,44.0
"Yautia (tannier), raw",98.0,1.46,0.4,23.6,598.0,9.0,24.0
Yeast extract spread,185.0,23.9,0.9,20.4,2100.0,67.0,180.0
